{
  "$schema": "./pixso-component-facts.schema.json",
  "schemaVersion": 1,
  "kind": "text-to-ui.pixso-component-facts",
  "document": "鸿蒙客户端设计规范",
  "page": "NewComponents",
  "source": "Pixso Plugin API read-only facts; Search refreshed live and unchanged inventory preserved from the last complete snapshot",
  "capturedAt": "2026-09-29T09:32:59.559Z",
  "scope": "page-wide-top-level-component-inventory-with-geometry",
  "policy": {
    "identity": "组件名称必须与当前 Pixso Component Set 或 COMPONENT 的 name 完全一致，区分大小写。",
    "ids": "不保存 GUID、node ID、file key；执行时必须从当前 Pixso 文件重新解析。",
    "variantSource": "Variant 轴和值只读取 variantProperties；不从 Variant 显示名称推断已删除的轴。",
    "geometrySource": "几何事实只读取当前 COMPONENT 的 Plugin API 属性，用于同步 Token 映射。",
    "captureTraversal": "page-descendant-top-level"
  },
  "componentSets": [
    {
      "name": ".Arrow",
      "classification": "helper",
      "variantAxes": {
        "属性 1": [
          "down",
          "right",
          "up"
        ]
      },
      "variants": [
        {
          "name": "属性 1=down",
          "variantProperties": {
            "属性 1": "down"
          },
          "geometry": {
            "width": 24,
            "height": 24,
            "itemSpacing": 0,
            "cornerRadius": 0,
            "padding": {
              "top": 0,
              "right": 0,
              "bottom": 0,
              "left": 0
            },
            "layoutMode": "NONE",
            "primaryAxisAlignItems": "MIN",
            "counterAxisAlignItems": "MIN"
          }
        },
        {
          "name": "属性 1=right",
          "variantProperties": {
            "属性 1": "right"
          },
          "geometry": {
            "width": 24,
            "height": 24,
            "itemSpacing": 0,
            "cornerRadius": 0,
            "padding": {
              "top": 0,
              "right": 0,
              "bottom": 0,
              "left": 0
            },
            "layoutMode": "NONE",
            "primaryAxisAlignItems": "MIN",
            "counterAxisAlignItems": "MIN"
          }
        },
        {
          "name": "属性 1=up",
          "variantProperties": {
            "属性 1": "up"
          },
          "geometry": {
            "width": 24,
            "height": 24,
            "itemSpacing": 0,
            "cornerRadius": 0,
            "padding": {
              "top": 0,
              "right": 0,
              "bottom": 0,
              "left": 0
            },
            "layoutMode": "NONE",
            "primaryAxisAlignItems": "MIN",
            "counterAxisAlignItems": "MIN"
          }
        }
      ]
    },
    {
      "name": ".Dialog_Container",
      "classification": "helper",
      "variantAxes": {
        "quantity": [
          "1_normal",
          "2_emphasize",
          "2_normal",
          "3_emphasize_port"
        ]
      },
      "variants": [
        {
          "name": "quantity=1_normal",
          "variantProperties": {
            "quantity": "1_normal"
          },
          "geometry": {
            "width": 400,
            "height": 56,
            "itemSpacing": 0,
            "padding": {
              "top": 0,
              "right": 0,
              "bottom": 0,
              "left": 0
            },
            "layoutMode": "NONE",
            "primaryAxisAlignItems": "MIN",
            "counterAxisAlignItems": "MIN"
          }
        },
        {
          "name": "quantity=2_emphasize",
          "variantProperties": {
            "quantity": "2_emphasize"
          },
          "geometry": {
            "width": 400,
            "height": 56,
            "itemSpacing": 16,
            "padding": {
              "top": 0,
              "right": 16,
              "bottom": 16,
              "left": 16
            },
            "layoutMode": "HORIZONTAL",
            "primaryAxisAlignItems": "MIN",
            "counterAxisAlignItems": "MIN"
          }
        },
        {
          "name": "quantity=2_normal",
          "variantProperties": {
            "quantity": "2_normal"
          },
          "geometry": {
            "width": 400,
            "height": 56,
            "itemSpacing": 16,
            "padding": {
              "top": 0,
              "right": 16,
              "bottom": 16,
              "left": 16
            },
            "layoutMode": "HORIZONTAL",
            "primaryAxisAlignItems": "MIN",
            "counterAxisAlignItems": "MIN"
          }
        },
        {
          "name": "quantity=3_emphasize_port",
          "variantProperties": {
            "quantity": "3_emphasize_port"
          },
          "geometry": {
            "width": 400,
            "height": 152,
            "itemSpacing": 8,
            "padding": {
              "top": 0,
              "right": 16,
              "bottom": 16,
              "left": 16
            },
            "layoutMode": "VERTICAL",
            "primaryAxisAlignItems": "MIN",
            "counterAxisAlignItems": "MIN"
          }
        }
      ]
    },
    {
      "name": ".Dialog_title",
      "classification": "helper",
      "variantAxes": {
        "属性 1": [
          ".Titl1e",
          ".Title"
        ]
      },
      "variants": [
        {
          "name": "属性 1=.Titl1e",
          "variantProperties": {
            "属性 1": ".Titl1e"
          },
          "geometry": {
            "width": 400,
            "height": 56,
            "itemSpacing": 16,
            "cornerRadius": 0,
            "padding": {
              "top": 15,
              "right": 0,
              "bottom": 15,
              "left": 0
            },
            "layoutMode": "HORIZONTAL",
            "primaryAxisAlignItems": "MIN",
            "counterAxisAlignItems": "CENTER"
          }
        },
        {
          "name": "属性 1=.Title",
          "variantProperties": {
            "属性 1": ".Title"
          },
          "geometry": {
            "width": 400,
            "height": 67,
            "itemSpacing": 16,
            "padding": {
              "top": 12,
              "right": 0,
              "bottom": 12,
              "left": 0
            },
            "layoutMode": "HORIZONTAL",
            "primaryAxisAlignItems": "MAX",
            "counterAxisAlignItems": "CENTER"
          }
        }
      ]
    },
    {
      "name": ".Tab Item",
      "classification": "helper",
      "variantAxes": {
        "state": [
          "Selected",
          "Unselected"
        ]
      },
      "variants": [
        {
          "name": "state=Selected",
          "variantProperties": {
            "state": "Selected"
          },
          "geometry": {
            "width": 64,
            "height": 36,
            "itemSpacing": 0,
            "cornerRadius": 6,
            "padding": {
              "top": 0,
              "right": 16,
              "bottom": 0,
              "left": 16
            },
            "layoutMode": "HORIZONTAL",
            "primaryAxisAlignItems": "CENTER",
            "counterAxisAlignItems": "CENTER"
          }
        },
        {
          "name": "state=Unselected",
          "variantProperties": {
            "state": "Unselected"
          },
          "geometry": {
            "width": 64,
            "height": 36,
            "itemSpacing": 0,
            "cornerRadius": 6,
            "padding": {
              "top": 0,
              "right": 16,
              "bottom": 0,
              "left": 16
            },
            "layoutMode": "HORIZONTAL",
            "primaryAxisAlignItems": "CENTER",
            "counterAxisAlignItems": "CENTER"
          }
        }
      ]
    },
    {
      "name": "Accordion",
      "classification": "business",
      "variantAxes": {
        "State": [
          "Collapsed",
          "Expanded"
        ]
      },
      "variants": [
        {
          "name": "State=Collapsed",
          "variantProperties": {
            "State": "Collapsed"
          },
          "geometry": {
            "width": 320,
            "height": 24,
            "itemSpacing": 8,
            "cornerRadius": 8,
            "padding": {
              "top": 0,
              "right": 8,
              "bottom": 0,
              "left": 8
            },
            "layoutMode": "HORIZONTAL",
            "primaryAxisAlignItems": "MIN",
            "counterAxisAlignItems": "CENTER"
          }
        },
        {
          "name": "State=Expanded",
          "variantProperties": {
            "State": "Expanded"
          },
          "geometry": {
            "width": 320,
            "height": 24,
            "itemSpacing": 8,
            "cornerRadius": 8,
            "padding": {
              "top": 0,
              "right": 8,
              "bottom": 0,
              "left": 8
            },
            "layoutMode": "HORIZONTAL",
            "primaryAxisAlignItems": "MIN",
            "counterAxisAlignItems": "CENTER"
          }
        }
      ]
    },
    {
      "name": "Alert",
      "classification": "business",
      "variantAxes": {
        "属性 1": [
          "Error",
          "Info",
          "Neutral",
          "Success",
          "Warning"
        ]
      },
      "variants": [
        {
          "name": "属性 1=Error",
          "variantProperties": {
            "属性 1": "Error"
          },
          "geometry": {
            "width": 720,
            "height": 40,
            "itemSpacing": 12,
            "cornerRadius": 8,
            "padding": {
              "top": 0,
              "right": 4,
              "bottom": 0,
              "left": 8
            },
            "layoutMode": "HORIZONTAL",
            "primaryAxisAlignItems": "MIN",
            "counterAxisAlignItems": "CENTER"
          }
        },
        {
          "name": "属性 1=Info",
          "variantProperties": {
            "属性 1": "Info"
          },
          "geometry": {
            "width": 720,
            "height": 40,
            "itemSpacing": 12,